{
  "$schema": "https://json-schema.org/draft/2020-12/schema",
  "$id": "https://amendment-atoms.com/schemas/atom-v1.json",
  "title": "amendment-atoms v1 proposal atom",
  "description": "A single amendment proposal atom. Records a typed, rationale-bearing proposal to change a target document — additive, corrective, breaking, deprecation, or revocation.",
  "type": "object",
  "required": ["schema", "type", "id", "version", "name", "target_document", "change_type", "rationale"],
  "additionalProperties": false,
  "properties": {
    "schema": {
      "type": "string",
      "const": "https://amendment-atoms.com/schemas/atom-v1.json"
    },
    "type": {
      "type": "string",
      "const": "proposal"
    },
    "id": {
      "type": "string",
      "pattern": "^[a-z0-9][-a-z0-9/]*[a-z0-9]$",
      "description": "Slash-namespaced atom ID, e.g. amendment-atoms/proposal/common-md-autonomy-v0.19"
    },
    "version": {
      "type": "string",
      "pattern": "^[0-9]+\\.[0-9]+\\.[0-9]+(?:-[A-Za-z0-9.-]+)?$"
    },
    "name": {
      "type": "string",
      "minLength": 1,
      "maxLength": 120
    },
    "description": {
      "type": "string",
      "maxLength": 500
    },
    "target_document": {
      "type": "string",
      "description": "Atom ID (with optional @semver) of the document being amended, e.g. constitution-atoms/charter/ai-governance@0.3.0"
    },
    "change_type": {
      "type": "string",
      "enum": ["additive", "corrective", "breaking", "deprecation", "revocation"]
    },
    "rationale": {
      "type": "string",
      "minLength": 10,
      "description": "Why this change is needed. Must name the operational failure, gap, or improvement it addresses."
    },
    "proposed_text": {
      "type": "string",
      "description": "The exact replacement or addition text for the target document section."
    },
    "effective_date": {
      "type": "string",
      "format": "date",
      "description": "ISO-8601 date on which this amendment takes effect."
    },
    "status": {
      "type": "string",
      "enum": ["proposed", "accepted", "rejected", "superseded"],
      "default": "proposed"
    },
    "proposed_by": {
      "type": "string",
      "description": "Identity of the proposer — org slug, user handle, or DID."
    },
    "superseded_by": {
      "type": "string",
      "description": "ID of the amendment that supersedes this one, if status=superseded."
    },
    "tags": {
      "type": "array",
      "items": { "type": "string", "minLength": 1, "maxLength": 40 },
      "uniqueItems": true
    }
  },
  "if": {
    "properties": { "status": { "const": "superseded" } },
    "required": ["status"]
  },
  "then": {
    "required": ["superseded_by"]
  }
}
